{
  "$schema": "https://json-schema.org/draft/2020-12/schema",
  "$id": "https://orchestratorai.local/schemas/workflows/workflow-run.v0.schema.json",
  "title": "Workflow Run Record v0",
  "type": "object",
  "required": [
    "id",
    "workflowId",
    "workflowName",
    "status",
    "profileId",
    "startedAt",
    "client",
    "matter",
    "stages",
    "outputs"
  ],
  "properties": {
    "id": { "type": "string" },
    "workflowId": { "type": "string" },
    "workflowName": { "type": "string" },
    "status": { "enum": ["queued", "running", "waiting_for_human", "completed", "failed", "cancelled"] },
    "profileId": { "type": "string" },
    "startedAt": { "type": "string", "format": "date-time" },
    "completedAt": { "type": ["string", "null"], "format": "date-time" },
    "client": { "$ref": "display-envelope.v0.schema.json#/$defs/displayEntity" },
    "matter": { "$ref": "display-envelope.v0.schema.json#/$defs/displayEntity" },
    "stages": {
      "type": "array",
      "items": { "$ref": "display-envelope.v0.schema.json#/$defs/stage" }
    },
    "humanReview": {
      "oneOf": [
        { "$ref": "human-review.v0.schema.json" },
        { "type": "null" }
      ]
    },
    "outputs": {
      "type": "array",
      "items": { "$ref": "display-envelope.v0.schema.json#/$defs/output" }
    },
    "events": {
      "type": "array",
      "items": {
        "type": "object",
        "required": ["timestamp", "type", "runId"],
        "properties": {
          "timestamp": { "type": "string", "format": "date-time" },
          "type": { "type": "string" },
          "runId": { "type": "string" },
          "workflowId": { "type": "string" },
          "stageId": { "type": "string" },
          "reviewId": { "type": "string" },
          "rawHermesRunId": { "type": "string" }
        },
        "additionalProperties": false
      }
    },
    "rawHermesRunId": { "type": "string" },
    "rawEventUri": { "type": "string" }
  },
  "additionalProperties": false
}
